Question,Category,Answer
Hello,Greeting,Hi! How can I assist you today?
Hi,Greeting,Hello! How can I help you with your programming needs?
What's your name?,Question,"I am JBRAIN, developed by Joshua Padilla."
How are you?,Greeting,"I'm doing great, thank you for asking! How can I assist you?"
What services do you offer?,Services,"I offer a variety of programming services including web development, mobile app development, and custom software solutions."
Can you help me with my programming project?,Services,"Of course! Let me know the details of your project, and I'll be happy to assist you."
What is freelancing in programming?,Freelancing,"Freelancing in programming means working on projects independently, often for multiple clients, without being tied to a single employer."
How can I contact you?,Contact,"You can contact me through email or messaging apps. Feel free to reach out anytime."
Do you offer free consultations?,Consultation,"I offer free initial consultations where we can discuss your project and how I can assist you."
What are your working hours?,Working Hours,"I am available for consultation and work from Monday to Friday, 9 AM to 6 PM."
What programming languages do you specialize in?,Languages,"I specialize in languages such as Python, JavaScript, C++, and PHP."
How do I get started with freelancing in programming?,Getting Started,"You can start by building a portfolio, joining freelancing platforms, and networking with potential clients."
How do I set my hourly rate?,Pricing,"Your hourly rate depends on your skills, experience, and the complexity of the projects you work on. Research market rates to find a competitive price."
Do you provide project estimates?,Services,"Yes, I provide project estimates based on the requirements and scope of work. Feel free to share the project details for a quote."
What is your experience in software development?,Experience,"I have over X years of experience working on various software development projects, including web and mobile apps."
How do I communicate with clients during a project?,Communication,"I typically communicate via email, messaging apps, and video calls to ensure regular updates and a clear understanding of project requirements."
Can you help with bug fixes in my code?,Services,"Yes, I can help debug and fix issues in your code. Provide the details, and I'll assist in resolving the problem."
What is your payment method?,Payments,"I accept payments through Gcash, bank transfers, or other online payment methods depending on the client."
Do you work with international clients?,Clients,"Yes, I work with clients from around the world. I have experience collaborating with clients in different time zones."
Can you provide references from past clients?,References,"Yes, I can provide references upon request. Just let me know if you'd like to see examples of past work or testimonials."
Where can we find your developer?,Communication,"Go to this link and message this account: https://web.facebook.com/joshuapadilla895."
May I see your sample ecommerce project?,Question,"Just Type `ecommerce project` "
